{
  "schema_name": "AAS.OperationEnvelope",
  "schema_version": "1.0.0",
  "message_id": "9f8848eb-c783-48d0-8f5f-c2a8d462cc14",
  "correlation_id": "ebcbeb0e-4de8-42c6-86de-d68e5c679420",
  "trace_id": "34d3b78d-b16d-4f3e-b9f5-b0994ff18f30",
  "timestamp_utc": "2026-02-14T09:00:10Z",
  "source": {
    "repo": "AaroneousAutomationSuite/Hub",
    "component": "hub_orchestrator"
  },
  "target": {
    "repo": "AaroneousAutomationSuite/Merlin",
    "component": "merlin_api_server"
  },
  "operation": {
    "name": "merlin.llm.cost.report",
    "version": "1.0.0",
    "timeout_ms": 30000,
    "idempotency_key": "llm-cost-report-2026-02-14-0001",
    "expects_ack": true,
    "retry": {
      "max_attempts": 1
    }
  },
  "payload": {
    "days": 7
  }
}
